Organizations,Categories
American Battle Monuments Commission,Arts & Culture
Barry Goldwater Scholarship and Excellence in Education Foundation,Education
Consumer Financial Protection Bureau,Business & Economy
Delta Regional Authority,Business & Economy
Denali Commission,Business & Economy;Infrastructure
Bureau of Economic Analysis,Business & Economy;Science & Research
Bureau of Industry and Security,National Security & Defense
Census Bureau,Business & Economy;Education;Health & Healthcare;Housing & Community Development;Labor & Employment;Social Services
Department of Commerce,Business & Economy;Finance & Budget
Economic Development Administration,Business & Economy
International Trade Administration,Business & Economy
Minority Business Development Agency,Business & Economy
NASA GSFC,Science & Research
National Institute of Standards and Technology,Science & Research
National Oceanic and Atmospheric Administration,Climate & Environment
National Science and Technology Council,Science & Research
National Technical Information Service,Science & Research
National Telecommunications and Information Administration,Science & Research
National Weather Service,Climate & Environment;Humanitarian & Disaster Relief;Science & Research
NOAA Coastal Services Center,Climate & Environment;Humanitarian & Disaster Relief;Science & Research
NOAA/National Hurricane Center,Climate & Environment;Humanitarian & Disaster Relief
NOAA/NCDC,Climate & Environment;Humanitarian & Disaster Relief;Science & Research
NOAA/Space Weather Prediction Center,Climate & Environment;Humanitarian & Disaster Relief;Science & Research
NWS/OPS33,Climate & Environment;Humanitarian & Disaster Relief;Science & Research
Office of the Chief Information Officer,Agriculture;Labor & Employment;Science & Research
Office of the Federal Coordinator for Meteorolgy,Climate & Environment;Humanitarian & Disaster Relief;Science & Research
Office of the Secretary,Health & Healthcare
Space Environment Center W/NP9,Science & Research
U. S. National Ice Center,Climate & Environment;Science & Research
USPTO,Science & Research
West Coast & Alaska Tsunami Warning Center,Climate & Environment;Humanitarian & Disaster Relief;Science & Research
Advanced Distributed Learning Initiative,Education;National Security & Defense
Air Force,National Security & Defense
Army,National Security & Defense
Army Corps of Engineers,National Security & Defense
Civil Air Patrol,National Security & Defense
Civil Air Patrol - USAF AUX.,National Security & Defense
CNSS Secretariat,National Security & Defense
Coast Guard,National Security & Defense
Combating Terrorism Technical Support Office,National Security & Defense
Defense Cyber Crime Center,National Security & Defense
Defense Health Agency,Health & Healthcare;National Security & Defense
Defense Logistics Agency,National Security & Defense
Defense Media Activity,National Security & Defense
Defense-wide,National Security & Defense
Department of Defense,National Security & Defense
Federal Voting Assistance Program,Social Services
FEHRM,Health & Healthcare
Irregular Warfare Technical Support Directorate,National Security & Defense
Joint,National Security & Defense
Marine Corps,National Security & Defense
National Guard,National Security & Defense
National Security Agency,National Security & Defense
National Security Agency - Laboratory for Physical Sciences,National Security & Defense;Science & Research
National Security Education Program (NSEP) at DLNSEO,Education;National Security & Defense
Navy,National Security & Defense
NRO,National Security & Defense
Office of Local Defense Community Cooperation,National Security & Defense
Office of the Under Secretary of Defense for Acquisition - Technology and Logistics,National Security & Defense
Office of Warrior Care Policy,National Security & Defense
PEO DHMS,Health & Healthcare;National Security & Defense
Space Force,National Security & Defense;Science & Research
TAK Product Center,Climate & Environment;Science & Research
Technical Support Working Group,National Security & Defense;Science & Research
US Army Corps of Engineers,National Security & Defense;Science & Research
Department of Education,Education
Office of Chief Information Officer,Education
Ames Laboratory,Energy;Science & Research
Argonne National Laboratory,Energy;Science & Research
Battelle Pacific Northwest National Laboratory,Climate & Environment;Energy;Science & Research
Bonneville Power Administration,Energy
Brookhaven National Laboratory,Energy;Science & Research
Department of Energy,Energy
Energy Information Administration,Energy
Fermi National Accelerator Laboratory,Energy;Science & Research
Hanford Mission Integration Solutions,Energy;Science & Research
Idaho National Laboratory,Energy;Science & Research
Lawrence Berkeley National Laboratory,Energy
Lawrence Livermore National Laboratory,National Security & Defense;Science & Research
Los Alamos National Laboratory,Arts & Culture;Energy
National Energy Research Scientific Computing Center,Energy;Science & Research
National Nuclear Security Administration - National Security Technologies - LLC,National Security & Defense
National Renewable Energy Laboratory,Climate & Environment;Energy
Oak Ridge National Laboratory,Energy;Science & Research
Office of Electricity Delivery and Energy Reliability,Energy;Infrastructure
Office of Energy Efficiency and Renewable Energy,Energy
Office of Nuclear Energy,Energy
ORAU,Education;Health & Healthcare;Science & Research
OSTI,Energy;Science & Research
Pacific Northwest National Laboratory,Energy;Science & Research
Princeton Plasma Physics Lab,Energy;Science & Research
Sandia National Laboratories,Science & Research
Savannah River Nuclear Solutions (SRNS),Energy;Science & Research
The National Isotope Development Center,Energy
US Department of Energy - Office of the CIO,Energy
Western Area Power Administration,Energy
Administration for Children and Families,Health & Healthcare;Social Services
Administration for Children and Families (ACF),Health & Healthcare;Social Services
Administration for Community Living,Health & Healthcare;Social Services
Administration for Strategic Preparedness and Response,Humanitarian & Disaster Relief
Agency for Healthcare Research and Quality,Health & Healthcare
Assistant Secretary for Financial Resources - Office of the Secretary,Finance & Budget;Health & Healthcare
Assistant Secretary for Planning and Evaluation - Office of the Secretary,Health & Healthcare;Science & Research
Assistant Secretary for Preparedness and Response - Office of the Secretary,Health & Healthcare;Humanitarian & Disaster Relief
Centers for Disease Control and Prevention,Health & Healthcare
Centers for Disease Control and Prevention (CDC),Health & Healthcare
Centers for Medicare & Medicaid Services (CMS),Health & Healthcare;Social Services
Centers for Medicare and Medicaid Services,Health & Healthcare
Department of Health and Human Services,Health & Healthcare
Enterprise Information Technology - NIH,Health & Healthcare
Health & Human Services (HHS),Health & Healthcare
Health Resources and Services Administration,Health & Healthcare
Health Resources and Services Administration (HRSA),Health & Healthcare
Indian Health Service / Office of IT,Health & Healthcare
National Cancer Institute - NIH,Health & Healthcare
National Center for Advancing Translational Sciences,Health & Healthcare;Science & Research
National Institute of Neurological Disorders and Stroke,Health & Healthcare;Science & Research
National Institute on Alcohol Abuse and Alcoholism - NIH,Health & Healthcare;Science & Research
National Institute on Drug Abuse - NIH,Health & Healthcare;Science & Research
National Institutes of Health,Health & Healthcare
National Institutes of Health (NIH),Health & Healthcare;Science & Research
National Library of Medicine - NIH,Health & Healthcare;Science & Research
Office of Disease Prevention and Health Promotion - Office of the Secretary,Health & Healthcare;Science & Research
Office of Grants - Division of Workforce Development,Labor & Employment
Office of Public Health and Science - Office on Women's Health,Health & Healthcare;Science & Research
Office of the Assistant Secretary for Health - Office of the Secretary,Health & Healthcare
Office of the National Coordinator - Office of the Secretary,Health & Healthcare
Office of the Secretary,Health & Healthcare
Office of the Surgeon General - Office of the Secretary,Health & Healthcare
Program Support Center - Office of the Secretary,Health & Healthcare
Substance Abuse and Mental Health Services Administration,Health & Healthcare
Substance Abuse and Mental Health Services Administration (SAMHSA),Health & Healthcare;Science & Research;Social Services
U. S. Food and Drug Administration,Health & Healthcare;Science & Research
Cybersecurity and Infrastructure Security Agency,Infrastructure;National Security & Defense
DHS Office of Inspector General,National Security & Defense
Federal Emergency Management Agency,Climate & Environment;Humanitarian & Disaster Relief
Federal Law Enforcement Training Accredidation,Education;National Security & Defense
Federal Law Enforcement Training Center,Education;National Security & Defense
Federal Law Enforcement Training Centers,Education;National Security & Defense
Headquarters,National Security & Defense
Inaccessible - U.S. Customs and Border Protection,National Security & Defense
Server errpr - loads IIS welcome page - U.S. Customs and Border Protection,National Security & Defense
Transportation Security Administration,National Security & Defense
U.S. Citizenship and Immigration Services,National Security & Defense;Social Services
U.S. Coast Guard,National Security & Defense
U.S. Customs and Border Protection,National Security & Defense
U.S. Immigration and Customs Enforcement,National Security & Defense
United States Secret Service,National Security & Defense
Department of Housing and Urban Development,Housing & Community Development
Government National Mortgage Association,Housing & Community Development;Social Services
Office of Inspector General,Housing & Community Development
U.S. Department of Housing and Urban Development - Office of Policy Development and Research,Housing & Community Development
Web Master Pulic Affair,Finance & Budget;Housing & Community Development
Executive Office for Immigration Review,Justice & Public Safety
Bureau of Alcohol - Tobacco - Firearms and Explosives,Justice & Public Safety
Civil Division,Justice & Public Safety
Civil Rights Division,Justice & Public Safety
Criminal Division - Asset Forfeiture and Money Laundering Section (AFMLS),Justice & Public Safety
Department of Justice,Justice & Public Safety
Department of Justice - National Institute of Corrections,Justice & Public Safety
Department of Justice - Office of e-Government,Justice & Public Safety
Drug Enforcement Administration,Justice & Public Safety
Executive Office for Immigration Review,Justice & Public Safety
Federal Bureau of Investigation,Justice & Public Safety;National Security & Defense
Federal Bureau of Prisons,Justice & Public Safety
Internet Crime Complaint Center,Justice & Public Safety
Justice Management Division,Justice & Public Safety
Office of Community Oriented Policing Services,Justice & Public Safety
Office of Justice Programs,Justice & Public Safety
Office of Justice Programs - JG - service,Justice & Public Safety
Office of the Chief Information Officer,Justice & Public Safety
Office of the Inspector General,Justice & Public Safety
RCFL,Justice & Public Safety
U.S Immigration and Customs Enforcement,Justice & Public Safety
U.S. Department of Justice - BI - Domestic Security Alliance Council (DSAC),Justice & Public Safety
U.S. Department of Justice - National Security Division,Justice & Public Safety
U.S. Marshals Service,Justice & Public Safety
Unicor,Justice & Public Safety
Bureau of Labor Statistics,Business & Economy;Labor & Employment
Employee Benefits Security Administration,Labor & Employment
Employment and Training Administration (ETA),Labor & Employment
Employment and Training Administration (ETA) - Office of Apprenticeship,Labor & Employment
Employment and Training Administration (ETA) - Office of Job Corps,Labor & Employment
Employment and Training Administration (ETA) - Office of Unemployment Insurance,Labor & Employment
Employment Training Administration (ETA),Labor & Employment
Employment Training Administration (ETA) - Office of Foreign Labor Certification,Labor & Employment
Employment Training Administration (ETA) - Office of Unemployment Insurance,Labor & Employment;Social Services
Mine Safety & Health Administration,Labor & Employment
Mine Safety and Health Administration,Labor & Employment
Mine Safety and Health Administration - Replaced by egov.msha.gov and serves as a hot backup.,Labor & Employment
Occupational Safety and Health Administration,Labor & Employment
Office of Disability Employment Policy,Labor & Employment
Office of Federal Contract Compliance Programs,Labor & Employment
Office of Inspector General,Labor & Employment
Office of Public Affairs,Labor & Employment
Office of the Assistant Secretary for Administration and Management - For federal employees and contractors.,Labor & Employment
Office of the Assistant Secretary for Policy,Labor & Employment
Office of the Chief Information Officer,Labor & Employment
Office of Workers' Compensation Programs,Labor & Employment
Office of Workers' Compsenation Programs,Labor & Employment
Pension Benefit Guaranty Corporation,Labor & Employment
Veterans' Employment and Training Service,Labor & Employment;Military & Veterans Affairs
Wage and Hour Division,Labor & Employment
Bureau of Consular Affairs,State & Policy
Bureau of Diplomatic Security (DS),State & Policy
Bureau of East Asian and Pacific Affairs (EAP),State & Policy
Bureau of Global Public Affairs (GPA),Health & Healthcare
Bureau of Global Talent Management (GTM),State & Policy
Bureau of Information Resources Management (IRM),State & Policy
Bureau of Overseas Buildings Operations (OBO),Infrastructure;State & Policy
Bureau of Western Hemisphere Affairs (WHA),State & Policy
Foreign Service Grievance Board (S/FSGB),State & Policy
National Museum of American Diplomacy (R/PPR/NMAD),Arts & Culture;State & Policy
Office of the Historian - Foreign Service Institute (FSI/OH),State & Policy
Office of the Inspector General,State & Policy
Under Secretary for Management - Office of Fine Arts (M/FA),Arts & Culture;State & Policy
Advisory Committee on Water Information,Climate & Environment;Science & Research
Aviation Management Directorate,Justice & Public Safety
Bureau of Indian Affairs,Social Services
Bureau of Indian Education,Education;Social Services;State & Policy
Bureau of Land Management,State & Policy
Bureau of Land Management - Main Domain,State & Policy
Bureau of Reclamation,State & Policy
Department of the Interior,Climate & Environment;Humanitarian & Disaster Relief
Joint Fire Science Program,Humanitarian & Disaster Relief;Science & Research;State & Policy
Minerals Management Service,Climate & Environment
National Fire Plan Operations & Reporting System,Humanitarian & Disaster Relief;State & Policy
National Interagency Fire Center,Humanitarian & Disaster Relief;State & Policy
National Park Service,Climate & Environment;Infrastructure
National Wildfire Coordinating Group,Climate & Environment;Humanitarian & Disaster Relief
Office of Aviation Services,Justice & Public Safety;State & Policy
Office of Communications,Agriculture;Business & Economy;Communications
Office of Natural Resources Revenue,Climate & Environment;State & Policy
Office of Surface Mining,Climate & Environment;State & Policy
Office of the Chief Information Officer,State & Policy
ONRR,Climate & Environment;State & Policy
Piedras Blancas Light Station,Climate & Environment;State & Policy
U.S. DEPARTMENT OF INTERIOR / OIG,Climate & Environment;State & Policy
U.S. Fish and Wildlife Service,Climate & Environment;State & Policy
U.S. Geological Survey,Climate & Environment;Infrastructure;Science & Research
USGS-NWRC,Climate & Environment
USGS/Denver Federal Center,Climate & Environment
Yosemite National Park,Climate & Environment;State & Policy
Alcohol and Tobacco Tax and Trade Bureau,State & Policy
Bureau of Engraving and Printing,Finance & Budget
Bureau of the Fiscal Service,Finance & Budget
CDFI,Finance & Budget;Housing & Community Development
Comptroller of the Currency,Finance & Budget
Department of the Treasury - DO,Finance & Budget
Department of the Treasury - OCIO,Finance & Budget
Departmental Offices,Finance & Budget
Financial Crimes Enforcement Network,Finance & Budget;Justice & Public Safety
Internal Revenue Service,Finance & Budget
U.S. Mint,Finance & Budget
Bureau of Transportation Statistics,Science & Research;Transportation
Department of Transportation,Transportation
Federal Aviation Administration,Transportation
Federal Highway Administration,Transportation
Federal Motor Carrier Safety Administration,Transportation
Federal Railroad Administration,Transportation
Federal Transit Administration,Transportation
Great Lakes St. Lawrence ,Transportation
Maritime Administration,Transportation
National Highway Traffic Safety Administration,Transportation
Pipeline and Hazardous Material Safety Administration,Infrastructure;Science & Research
Volpe Center,Transportation
Department of Veterans Affairs,Military & Veterans Affairs
Office of Information and Technology - IT Operations and Services (ITOPS),Military & Veterans Affairs;Science & Research
Environmental Protection Agency,Climate & Environment
EPA OIG,Climate & Environment
Federal Remediation Roundtable,Climate & Environment
Office of Federal Sustainability,Climate & Environment;Energy
Equal Employment Opportunity Commission,Labor & Employment
Export-Import Bank of the United States,Business & Economy
Farm Credit System Insurance Corporation,Finance & Budget
Office of Information Technology,Finance & Budget
Federal Communications Commission,Communications
Office of the Managing Director,Communications
Federal Deposit Insurance Corporation,Finance & Budget
Federal Election Commission,State & Policy
Federal Energy Regulatory Commission,Energy
Federal Mine Safety & Health Review Commission,Labor & Employment
Federal Permitting Improvement Steering Council,Finance & Budget;Labor & Employment;State & Policy
Office of Technology Services,Social Services
Division of Consumer & Business Education (DCBE),Business & Economy
Division of Consumer Response & Operations (DCRO),Business & Economy
Office of Internal Affairs (OIA),Business & Economy
Office of Public Affairs (OPA),Business & Economy
400 Years of African American History Commission,Arts & Culture
Civilian Board of Contract Appeals,State & Policy
General Services Administration,Infrastructure;State & Policy
GSA Office of Inspector General,Infrastructure;State & Policy
GSA - CIO.GOV,Infrastructure;State & Policy
GSA - FAS - Acquisition,Infrastructure;State & Policy
GSA - FAS - Advantage,Infrastructure;State & Policy
GSA - FAS - ClearPath,Infrastructure;State & Policy
GSA - FAS - FPDS,Infrastructure;State & Policy
GSA - FAS - Office of Enterprise Strategy Management,Infrastructure;State & Policy
GSA - FAS - SASy,Infrastructure;State & Policy
GSA - FAS - System for Award Management,Infrastructure;State & Policy
GSA - IC - Acquisition,Infrastructure;State & Policy
GSA - IC - FAI,State & Policy
GSA - IC - OGP Web Portfolio,State & Policy
GSA - IC - OGP WebPortfolio,State & Policy
GSA - IC - ROCIS,State & Policy
GSA - IDI - EAS-SF,State & Policy
GSA - IDI - ECAS II,Business & Economy
GSA - IDI - ECAS II,State & Policy
GSA - IDI - Enterprise Application Services,State & Policy
GSA - IDI -EAS,State & Policy
GSA - IQ-ESRS-FSRS,State & Policy
GSA - IQ-FPDS-FPDS Portal,Finance & Budget
GSA - IQ-FSD-FSD Portal,State & Policy
GSA - IQ-GSAAdvantage-Main,State & Policy
GSA - IQ-SASy-GSAAuctions,State & Policy
GSA - IQ - Clearpath,State & Policy
GSA - IQ - eRulemaking,State & Policy
GSA - Office of Government-wide Policy,State & Policy
GSA - Q-FPKI,State & Policy
GSA - TTS - Federalist,State & Policy
GSA -FAS -Technology Transformation Service,Finance & Budget;Housing & Community Development
Office of Government-wide Policy,State & Policy
Institute of Museum and Library Services,Arts & Culture
Inter-American Foundation,Infrastructure;Social Services
US Merit Systems Protection Board,Justice & Public Safety;Labor & Employment
Morris K. Udall and Stewart L. Udall Foundation,Education;Infrastructure;Social Services
Homepage appears to have no content - but content is available to public on sub-paths. NASA Stennis Space Center,Science & Research
Jet Propulsion Lab Communications and Education Directorate,Science & Research
NASA Ames Research Center,Science & Research
NASA Armstrong Flight Research Center,Science & Research
NASA Glenn Research Center,Science & Research
NASA Goddard Space Flight Center,Science & Research
NASA Jet Propulsion Laboratory,Science & Research
NASA Johnson Space Center,Science & Research
NASA Kennedy Space Center,Science & Research
NASA Langley Research Center,Science & Research
NASA Marshall Space Flight Center,Science & Research
NASA Office of Small Business Programs,Science & Research
NASA Office of STEM Engagement,Science & Research
NASA Office of the Chief Information Officer,Science & Research
NASA Science Data Systems Branch,Science & Research
NASA Science Mission Directorate,Science & Research
NASA Stennis Space Center,Science & Research
National Aeronautics and Space Administration,Science & Research
Gerald R. Ford Library and Museum,Arts & Culture
Jimmy Carter Library & Museum,Arts & Culture
National Archives and Records Administration,Arts & Culture;Science & Research
William Clinton Presidential Library,Arts & Culture
National Council on Disability,Science & Research
National Credit Union Administration,Finance & Budget;Social Services
Office of Information and Technology Management,Arts & Culture
Office of Information Resources Management,Energy;Finance & Budget
National Labor Relations Board,Labor & Employment
National Mediation Board,Labor & Employment
National Science Foundation,Science & Research
National Science Foundation - Office of Polar Programs,Science & Research
Small Agency Council,Finance & Budget;State & Policy
U.S. Arctic Research Commission,Science & Research
National Transportation Safety Board,Transportation
Northern Border Regional Commission,Business & Economy;Infrastructure;Social Services
Nuclear Regulatory Commission,Health & Healthcare;Science & Research
Occupational Safety & Health Review Commission,Labor & Employment
Office of Government Ethics,State & Policy
Office of Navajo and Hopi Indian Relocation,Justice & Public Safety;Social Services;State & Policy
Chief Human Capital Officers,Labor & Employment
Office of Personnel Management,Labor & Employment
OPM Center for Leadership Development,Education;Labor & Employment
OPM Human Resource Solutions,Labor & Employment
Presidential Management Fellows,Labor & Employment
Office of Benefits Administration,Social Services
Office of Chief Financial Officer,Social Services
Office of Information Technology,Social Services
Bureau of Information Services,Social Services
Network Operations Branch,Infrastructure;National Security & Defense
Selective Service System,Military & Veterans Affairs
SBA-Office of Innovation & Technology,Social Services
Small Business Administration,Social Services
SSA/OSOHE/Division of Network Engineering,Social Services
Surface Transportation Board,Transportation
Tennessee Valley Authority Office of Inspector General,Justice & Public Safety
TVA IT,Justice & Public Safety
AFR ES,Infrastructure;Science & Research;Social Services
Bureau for Resilience and Food Security (RFS),Humanitarian & Disaster Relief;Infrastructure;Science & Research;Social Services
Foreign Assistance Office (F/PPS),Humanitarian & Disaster Relief
GH,Humanitarian & Disaster Relief;Infrastructure;Science & Research;Social Services
M/CIO,Humanitarian & Disaster Relief
Office of the Director of U.S. Foreign Assistance,Humanitarian & Disaster Relief;Infrastructure;Science & Research;Social Services
U.S. Commission for the Preservation of America's Heritage Abroad,Humanitarian & Disaster Relief;Infrastructure;Science & Research;Social Services
Agricultural Research Service,Agriculture;Science & Research
Aviation Management Directorate,Agriculture
National Advanced Fire and Resource Institute,Agriculture;Infrastructure;Science & Research
National Agricultural Library,Agriculture;Science & Research
National Finance Center,Agriculture;Finance & Budget
National Wildfire Coordinating Group,Agriculture;Humanitarian & Disaster Relief;Infrastructure
Office of Energy Policy and New Uses,Agriculture;Energy
Recreation One Stop,Agriculture
Rural Development,Agriculture;Infrastructure
U.S. Department of Agriculture,Agriculture
US Forest Service,Agriculture;Science & Research
USDA - Center for Nutrition Policy and Promotion,Agriculture
USDA Forest Service - Southwestern Region,Agriculture
USDA - ARS - NAL,Agriculture
USDA - Office of Communications,Agriculture
USDA/ARS/NAL,Agriculture
U.S Access Board,Communications
IBB/VOA/BBG,Communications
VOA,Communications
US International Development Finance Corporation,Finance & Budget
OCIO,Finance & Budget
Office for Civil Rights,Justice & Public Safety;Labor & Employment;Social Services
Federal Housing Finance Agency,Finance & Budget;Housing & Community Development
Substance Abuse and Mental Health Services Administration,Health & Healthcare;Science & Research;Social Services
Institute of Museum and Library Services,Arts & Culture;Education;Science & Research;Social Services
Office of the Chief Information Officer,Science & Research;Social Services
AmeriCorps,Humanitarian & Disaster Relief;Military & Veterans Affairs
National Parks Service,Climate & Environment;Social Services
Federal Mediation and Conciliation Service,Labor & Employment
